record_id,redcap_repeat_instrument,redcap_repeat_instance,redcap_survey_identifier,form_1_timestamp,form_1_complete,deneyim_kayd_timestamp,exp_time,current,past,type,location,loc_spec,descr,feedback,identity___1,identity___2,identity___3,identity___4,identity___5,identity_spec,social_type___1,social_type___2,social_type___3,social_type___4,removal,future_use,uuid_2,startdate_2,enddate_2,scheduledate_2,status_2,supplementaldata_2,serializedresult_2,deneyim_kayd_complete
IZTECH_S006,,,,,2,,,,,,,,,,,,,,,,,,,,,,,,,,,,,
IZTECH_S006,deneyim_kayd,2,,,,,1,"2025-02-17 15:39",,2,2,,"Gözlük üzerindeki cihazı kameraya benzetti çevredekiler, canlı yayın mı yapıyorsun diye soranlar oldu:). Bilekliğin de nabız ölçer cihaz olduğunu düşündüler. ",1,0,1,0,0,0,,1,1,0,0,0,Etkilemeyecek,29D0D2F0-ED2C-11EF-A613-D3C4AF4EB08D,"2025-02-17 15:39:00","2025-02-17 15:41:34",,1,"{    ""devicemanufacturer"": ""TECNO"",    ""deviceplatform"": ""Android"",    ""deviceversion"": ""13"",    ""syncdate"": ""2025-02-17 15:41:35"",    ""utcTime"": ""2025-02-17 12:39:00.767358Z"",    ""projectLanguageSelected"": ""en-US"",    ""timezone"": ""+03"",    ""appversion"": ""2.1.8"",    ""buildnumber"": ""153"",    ""configversion"": ""10"",    ""devicemodel"": ""TECNO KI7"",    ""percentComplete"": ""77""  }",result.zip,2
IZTECH_S006,deneyim_kayd,3,,,,,2,,"2025-02-17 16:00",3,2,,"Deneyin detaylarını anlattığım zaman, hocam neden bu kadar fazla cihaz gerektiğini merak etti ve bu durumun biraz sıkıcı olabileceğini belirtti. Ben de aynısını düşünmüştüm bu konuda, tabi detayları bilmediğim için bu şekilde yorum yapıyorum. Acaba bu cihazların tamamı bir araya toplanıp daha kolay kullanılabilecek bir cihaz geliştirilebilir miydi? ",1,0,1,0,0,0,,1,1,0,0,0,hayır,C87F49D0-ED4B-11EF-A613-D3C4AF4EB08D,"2025-02-17 19:25:21","2025-02-17 19:29:06",,1,"{    ""devicemanufacturer"": ""TECNO"",    ""deviceplatform"": ""Android"",    ""deviceversion"": ""13"",    ""syncdate"": ""2025-02-17 19:29:07"",    ""utcTime"": ""2025-02-17 16:25:21.389116Z"",    ""projectLanguageSelected"": ""en-US"",    ""timezone"": ""+03"",    ""appversion"": ""2.1.8"",    ""buildnumber"": ""153"",    ""configversion"": ""10"",    ""devicemodel"": ""TECNO KI7"",    ""percentComplete"": ""77""  }",result.zip,2
IZTECH_S006,deneyim_kayd,4,,,,,1,"2025-02-17 19:29",,2,2,,"Cihaz üzerinde çalışır durumda olmadığına dair bir ikaz ışığı vs olmaması, sorun teşkil edebilir diye düşünüyorum. Gece uyurken yanlışlıkla düğmeye basılsa veya gün içinde diğer cihazlarda da aynısı olsa. Cihazın kaydetmeye devam edip etmediğini anlayamacağım. ",0,0,0,0,0,0,,0,0,0,0,0,hayır,50E61C90-ED4C-11EF-A613-D3C4AF4EB08D,"2025-02-17 19:29:10","2025-02-17 19:31:15",,1,"{    ""devicemanufacturer"": ""TECNO"",    ""deviceplatform"": ""Android"",    ""deviceversion"": ""13"",    ""syncdate"": ""2025-02-17 19:31:15"",    ""utcTime"": ""2025-02-17 16:29:10.233693Z"",    ""projectLanguageSelected"": ""en-US"",    ""timezone"": ""+03"",    ""appversion"": ""2.1.8"",    ""buildnumber"": ""153"",    ""configversion"": ""10"",    ""devicemodel"": ""TECNO KI7"",    ""percentComplete"": ""62""  }",result.zip,2
IZTECH_S006,deneyim_kayd,5,,,,,1,"2025-02-18 16:00",,3,2,,"Katıldığım toplantıda sesli veya görüntülü kayıt aldığım sanılarak ikaz edildim",1,0,1,1,0,0,,1,0,0,1,0,hayıt,9DF60380-EDF9-11EF-B874-5776011F5323,"2025-02-18 16:09:42","2025-02-18 16:11:10",,1,"{    ""devicemanufacturer"": ""TECNO"",    ""deviceplatform"": ""Android"",    ""deviceversion"": ""13"",    ""syncdate"": ""2025-02-18 16:11:11"",    ""utcTime"": ""2025-02-18 13:09:42.456688Z"",    ""projectLanguageSelected"": ""en-US"",    ""timezone"": ""+03"",    ""appversion"": ""2.1.8"",    ""buildnumber"": ""153"",    ""configversion"": ""10"",    ""devicemodel"": ""TECNO KI7"",    ""percentComplete"": ""77""  }",result.zip,2
IZTECH_S006,deneyim_kayd,6,,,,,1,"2025-02-19 15:40",,2,3,,"Gözlüğüm, saatçilerin kullandığı cihaza benzetildi, saat tamir ettiğim sanıldı:) ",1,0,0,0,1,0,,1,1,0,0,0,hayır,1DD2E760-EEBF-11EF-BBB3-B5B19439FC8B,"2025-02-19 15:43:27","2025-02-19 15:45:09",,1,"{    ""devicemanufacturer"": ""TECNO"",    ""deviceplatform"": ""Android"",    ""deviceversion"": ""13"",    ""syncdate"": ""2025-02-19 15:45:09"",    ""utcTime"": ""2025-02-19 12:43:27.830013Z"",    ""projectLanguageSelected"": ""en-US"",    ""timezone"": ""+03"",    ""appversion"": ""2.1.8"",    ""buildnumber"": ""153"",    ""configversion"": ""10"",    ""devicemodel"": ""TECNO KI7"",    ""percentComplete"": ""77""  }",result.zip,2
